{
  "$schema": "https://json-schema.org/draft/2020-12/schema",
  "type": "object",
  "properties": {
    "schema": {
      "type": "string",
      "const": "normlab.parking-extraction/v1"
    },
    "entities": {
      "maxItems": 128,
      "type": "array",
      "items": {
        "$ref": "#/$defs/__schema0"
      }
    },
    "spans": {
      "maxItems": 512,
      "type": "array",
      "items": {
        "$ref": "#/$defs/__schema3"
      }
    },
    "assertions": {
      "maxItems": 256,
      "type": "array",
      "items": {
        "$ref": "#/$defs/__schema4"
      }
    },
    "unmappedMentions": {
      "maxItems": 64,
      "type": "array",
      "items": {
        "$ref": "#/$defs/__schema8"
      }
    }
  },
  "required": [
    "schema",
    "entities",
    "spans",
    "assertions",
    "unmappedMentions"
  ],
  "additionalProperties": false,
  "$defs": {
    "__schema0": {
      "oneOf": [
        {
          "type": "object",
          "properties": {
            "id": {
              "$ref": "#/$defs/__schema1"
            },
            "evidence": {
              "$ref": "#/$defs/__schema2"
            },
            "concept": {
              "type": "string",
              "const": "nlcase:Participant"
            },
            "alias": {
              "type": "string",
              "pattern": "^[\\s\\S]{1,100}(?![\\s\\S])",
              "minLength": 1,
              "maxLength": 100
            },
            "participantKind": {
              "type": "string",
              "enum": [
                "person",
                "organization",
                "unknown"
              ]
            }
          },
          "required": [
            "id",
            "evidence",
            "concept",
            "alias",
            "participantKind"
          ],
          "additionalProperties": false
        },
        {
          "type": "object",
          "properties": {
            "id": {
              "$ref": "#/$defs/__schema1"
            },
            "evidence": {
              "$ref": "#/$defs/__schema2"
            },
            "concept": {
              "type": "string",
              "const": "nlcase:Vehicle"
            },
            "alias": {
              "type": "string",
              "pattern": "^[\\s\\S]{1,100}(?![\\s\\S])",
              "minLength": 1,
              "maxLength": 100
            }
          },
          "required": [
            "id",
            "evidence",
            "concept",
            "alias"
          ],
          "additionalProperties": false
        },
        {
          "type": "object",
          "properties": {
            "id": {
              "$ref": "#/$defs/__schema1"
            },
            "evidence": {
              "$ref": "#/$defs/__schema2"
            },
            "concept": {
              "type": "string",
              "const": "nlcase:Episode"
            },
            "label": {
              "type": "string",
              "pattern": "^[\\s\\S]{1,300}(?![\\s\\S])",
              "minLength": 1,
              "maxLength": 300
            }
          },
          "required": [
            "id",
            "evidence",
            "concept",
            "label"
          ],
          "additionalProperties": false
        },
        {
          "type": "object",
          "properties": {
            "id": {
              "$ref": "#/$defs/__schema1"
            },
            "evidence": {
              "$ref": "#/$defs/__schema2"
            },
            "concept": {
              "type": "string",
              "const": "nlcase:Location"
            },
            "label": {
              "type": "string",
              "pattern": "^[\\s\\S]{1,500}(?![\\s\\S])",
              "minLength": 1,
              "maxLength": 500
            }
          },
          "required": [
            "id",
            "evidence",
            "concept",
            "label"
          ],
          "additionalProperties": false
        },
        {
          "type": "object",
          "properties": {
            "id": {
              "$ref": "#/$defs/__schema1"
            },
            "evidence": {
              "$ref": "#/$defs/__schema2"
            },
            "concept": {
              "type": "string",
              "const": "nlcase:TimeInterval"
            },
            "startText": {
              "type": "string",
              "pattern": "^[\\s\\S]{1,200}(?![\\s\\S])",
              "minLength": 1,
              "maxLength": 200
            },
            "endText": {
              "type": "string",
              "pattern": "^[\\s\\S]{1,200}(?![\\s\\S])",
              "minLength": 1,
              "maxLength": 200
            },
            "timezoneText": {
              "type": "string",
              "pattern": "^[\\s\\S]{1,100}(?![\\s\\S])",
              "minLength": 1,
              "maxLength": 100
            },
            "precision": {
              "type": "string",
              "enum": [
                "exact",
                "approximate",
                "mixed",
                "unknown"
              ]
            }
          },
          "required": [
            "id",
            "evidence",
            "concept",
            "precision"
          ],
          "additionalProperties": false
        },
        {
          "type": "object",
          "properties": {
            "id": {
              "$ref": "#/$defs/__schema1"
            },
            "evidence": {
              "$ref": "#/$defs/__schema2"
            },
            "concept": {
              "type": "string",
              "const": "nlcase:RoleAssignment"
            },
            "role": {
              "type": "string",
              "enum": [
                "owner",
                "driver",
                "user",
                "narrator",
                "other"
              ]
            }
          },
          "required": [
            "id",
            "evidence",
            "concept",
            "role"
          ],
          "additionalProperties": false
        },
        {
          "type": "object",
          "properties": {
            "id": {
              "$ref": "#/$defs/__schema1"
            },
            "evidence": {
              "$ref": "#/$defs/__schema2"
            },
            "concept": {
              "type": "string",
              "const": "nlcase:MoneyAmount"
            },
            "amount": {
              "type": "number",
              "minimum": 0,
              "maximum": 1000000000
            },
            "currency": {
              "type": "string",
              "pattern": "^[A-Z]{3}$"
            }
          },
          "required": [
            "id",
            "evidence",
            "concept",
            "amount",
            "currency"
          ],
          "additionalProperties": false
        },
        {
          "type": "object",
          "properties": {
            "id": {
              "$ref": "#/$defs/__schema1"
            },
            "evidence": {
              "$ref": "#/$defs/__schema2"
            },
            "concept": {
              "type": "string",
              "const": "nlpark:ParkingPlacement"
            }
          },
          "required": [
            "id",
            "evidence",
            "concept"
          ],
          "additionalProperties": false
        },
        {
          "type": "object",
          "properties": {
            "id": {
              "$ref": "#/$defs/__schema1"
            },
            "evidence": {
              "$ref": "#/$defs/__schema2"
            },
            "concept": {
              "type": "string",
              "const": "nlpark:ParkingPlace"
            }
          },
          "required": [
            "id",
            "evidence",
            "concept"
          ],
          "additionalProperties": false
        },
        {
          "type": "object",
          "properties": {
            "id": {
              "$ref": "#/$defs/__schema1"
            },
            "evidence": {
              "$ref": "#/$defs/__schema2"
            },
            "concept": {
              "type": "string",
              "const": "nlpark:ParkingZone"
            }
          },
          "required": [
            "id",
            "evidence",
            "concept"
          ],
          "additionalProperties": false
        },
        {
          "type": "object",
          "properties": {
            "id": {
              "$ref": "#/$defs/__schema1"
            },
            "evidence": {
              "$ref": "#/$defs/__schema2"
            },
            "concept": {
              "type": "string",
              "const": "nlpark:ParkingSession"
            }
          },
          "required": [
            "id",
            "evidence",
            "concept"
          ],
          "additionalProperties": false
        },
        {
          "type": "object",
          "properties": {
            "id": {
              "$ref": "#/$defs/__schema1"
            },
            "evidence": {
              "$ref": "#/$defs/__schema2"
            },
            "concept": {
              "type": "string",
              "const": "nlpark:PaymentAttempt"
            }
          },
          "required": [
            "id",
            "evidence",
            "concept"
          ],
          "additionalProperties": false
        },
        {
          "type": "object",
          "properties": {
            "id": {
              "$ref": "#/$defs/__schema1"
            },
            "evidence": {
              "$ref": "#/$defs/__schema2"
            },
            "concept": {
              "type": "string",
              "const": "nlpark:Payment"
            }
          },
          "required": [
            "id",
            "evidence",
            "concept"
          ],
          "additionalProperties": false
        },
        {
          "type": "object",
          "properties": {
            "id": {
              "$ref": "#/$defs/__schema1"
            },
            "evidence": {
              "$ref": "#/$defs/__schema2"
            },
            "concept": {
              "type": "string",
              "const": "nlpark:PermitClaim"
            }
          },
          "required": [
            "id",
            "evidence",
            "concept"
          ],
          "additionalProperties": false
        },
        {
          "type": "object",
          "properties": {
            "id": {
              "$ref": "#/$defs/__schema1"
            },
            "evidence": {
              "$ref": "#/$defs/__schema2"
            },
            "concept": {
              "type": "string",
              "const": "nlpark:SessionCorrectionClaim"
            }
          },
          "required": [
            "id",
            "evidence",
            "concept"
          ],
          "additionalProperties": false
        },
        {
          "type": "object",
          "properties": {
            "id": {
              "$ref": "#/$defs/__schema1"
            },
            "evidence": {
              "$ref": "#/$defs/__schema2"
            },
            "concept": {
              "type": "string",
              "const": "nlpark:SanctionClaim"
            },
            "normReferenceText": {
              "type": "string",
              "pattern": "^[\\s\\S]{1,300}(?![\\s\\S])",
              "minLength": 1,
              "maxLength": 300
            }
          },
          "required": [
            "id",
            "evidence",
            "concept"
          ],
          "additionalProperties": false
        }
      ]
    },
    "__schema1": {
      "type": "string",
      "pattern": "^[A-Za-z][A-Za-z0-9_-]{0,63}$"
    },
    "__schema2": {
      "minItems": 1,
      "maxItems": 8,
      "type": "array",
      "items": {
        "$ref": "#/$defs/__schema1"
      }
    },
    "__schema3": {
      "type": "object",
      "properties": {
        "id": {
          "$ref": "#/$defs/__schema1"
        },
        "quote": {
          "type": "string",
          "pattern": "^[\\s\\S]{1,2000}(?![\\s\\S])",
          "minLength": 1,
          "maxLength": 2000
        },
        "startOffset": {
          "type": "integer",
          "minimum": 0,
          "maximum": 32768
        },
        "endOffset": {
          "type": "integer",
          "minimum": 1,
          "maximum": 32768
        }
      },
      "required": [
        "id",
        "quote",
        "startOffset",
        "endOffset"
      ],
      "additionalProperties": false
    },
    "__schema4": {
      "anyOf": [
        {
          "type": "object",
          "properties": {
            "id": {
              "$ref": "#/$defs/__schema1"
            },
            "subject": {
              "$ref": "#/$defs/__schema1"
            },
            "aboutEpisode": {
              "$ref": "#/$defs/__schema1"
            },
            "evidence": {
              "$ref": "#/$defs/__schema2"
            },
            "stance": {
              "$ref": "#/$defs/__schema5"
            },
            "attributedTo": {
              "$ref": "#/$defs/__schema6"
            },
            "attributionText": {
              "$ref": "#/$defs/__schema7"
            },
            "predicate": {
              "type": "string",
              "enum": [
                "nlcase:roleParticipant",
                "nlcase:roleAboutEpisode",
                "nlpark:placedAt",
                "nlpark:involvesVehicle",
                "nlpark:placeInZone",
                "nlpark:placementInEpisode",
                "nlpark:sessionInEpisode",
                "nlpark:paymentForSession",
                "nlpark:paymentTargetsVehicle",
                "nlpark:paymentTargetsZone",
                "nlpark:coversInterval",
                "nlpark:placementInterval",
                "nlpark:correctionAboutSession",
                "nlpark:permitAboutVehicle",
                "nlpark:sanctionAboutEpisode",
                "nlpark:sanctionAmount"
              ]
            },
            "object": {
              "$ref": "#/$defs/__schema1"
            }
          },
          "required": [
            "id",
            "subject",
            "aboutEpisode",
            "evidence",
            "stance",
            "attributedTo",
            "predicate",
            "object"
          ],
          "additionalProperties": false
        },
        {
          "type": "object",
          "properties": {
            "id": {
              "$ref": "#/$defs/__schema1"
            },
            "subject": {
              "$ref": "#/$defs/__schema1"
            },
            "aboutEpisode": {
              "$ref": "#/$defs/__schema1"
            },
            "evidence": {
              "$ref": "#/$defs/__schema2"
            },
            "stance": {
              "$ref": "#/$defs/__schema5"
            },
            "attributedTo": {
              "$ref": "#/$defs/__schema6"
            },
            "attributionText": {
              "$ref": "#/$defs/__schema7"
            },
            "predicate": {
              "type": "string",
              "enum": [
                "nlinput:eventTime",
                "nlinput:inMoscow",
                "nlinput:cityParking",
                "nlinput:placement",
                "nlinput:paidRegime",
                "nlinput:subjectScope",
                "nlinput:attribution",
                "nlinput:payment",
                "nlinput:paymentStart",
                "nlinput:departure",
                "nlinput:paymentComplexity",
                "nlinput:permit",
                "nlinput:disabilityConditions",
                "nlinput:specialTariff",
                "nlinput:faultAndExclusions"
              ]
            },
            "valueText": {
              "type": "string",
              "pattern": "^[\\s\\S]{1,1000}(?![\\s\\S])",
              "minLength": 1,
              "maxLength": 1000
            }
          },
          "required": [
            "id",
            "subject",
            "aboutEpisode",
            "evidence",
            "stance",
            "attributedTo",
            "predicate",
            "valueText"
          ],
          "additionalProperties": false
        }
      ]
    },
    "__schema5": {
      "type": "string",
      "enum": [
        "asserted",
        "denied",
        "uncertain"
      ]
    },
    "__schema6": {
      "maxItems": 8,
      "type": "array",
      "items": {
        "$ref": "#/$defs/__schema1"
      }
    },
    "__schema7": {
      "type": "string",
      "pattern": "^[\\s\\S]{1,500}(?![\\s\\S])",
      "minLength": 1,
      "maxLength": 500
    },
    "__schema8": {
      "type": "object",
      "properties": {
        "id": {
          "$ref": "#/$defs/__schema1"
        },
        "description": {
          "type": "string",
          "pattern": "^[\\s\\S]{1,1000}(?![\\s\\S])",
          "minLength": 1,
          "maxLength": 1000
        },
        "evidence": {
          "$ref": "#/$defs/__schema2"
        },
        "aboutEpisode": {
          "$ref": "#/$defs/__schema1"
        }
      },
      "required": [
        "id",
        "description",
        "evidence"
      ],
      "additionalProperties": false
    }
  },
  "$id": "urn:normlab:contract:parking-extraction:v1"
}
